은행명,주소,위도,경도,주소2
KB국민은행 제주종합금융센터," 제주특별자치도 제주시 남광북1길 1 제주법조타워 1,2층 ",33.494593216571,126.534320623238,이도이동
KB국민은행 연북로지점, 제주특별자치도 제주시 연북로 50 ,33.4815916076525,126.48666080169,노형동
하나은행 제주금융센터, 제주특별자치도 제주시 중앙로 58 ,33.5129224625522,126.524204690747,일도일동
신한은행 제주지점, 제주특별자치도 제주시 중앙로 166 ,33.5040331471722,126.526443081752,이도일동
하나은행 신제주지점, 제주특별자치도 제주시 1100로 3308 1층 ,33.4816322571847,126.481718642804,노형동
우리은행 제주지점, 제주특별자치도 제주시 중앙로 56 ,33.5134375429646,126.524252135361,일도일동
신한은행 신제주지점, 제주특별자치도 제주시 연북로 36 ,33.4816736990054,126.485172210639,노형동
우리은행 신제주금융센터, 제주특별자치도 제주시 연북로 14 온정빌딩 1층101호 ,33.4816962476543,126.482684331539,노형동
KB국민은행 서귀포지점, 제주특별자치도 서귀포시 중정로 55 1층 ,33.2478838792426,126.562224200521,서귀동
우리은행 서귀포지점, 제주특별자치도 서귀포시 중앙로 46 ,33.2487486429615,126.561868568291,서귀동
하나은행 서귀포지점, 제주특별자치도 서귀포시 월드컵로 8 ,33.2489939885441,126.507323170982,강정동
신한은행 서귀포지점, 제주특별자치도 서귀포시 일주동로 8707 ,33.2524785027918,126.558248389213,서귀동
NH농협은행 이도지점, 제주특별자치도 제주시 승천로 73 한라훠프라자 ,33.492433096931,126.542992622381,아라이동
NH농협은행 제주중앙지점, 제주특별자치도 제주시 오현길 75 ,33.5114368783846,126.524900680222,이도일동
KB국민은행 공무원연금공단출장소, 제주특별자치도 서귀포시 서호중앙로 63 ,33.2536692363329,126.518614379686,서호동
NH농협은행 제주시지부, 제주특별자치도 제주시 신대로 110 ,33.4874638675359,126.496197657717,연동
NH농협은행 제주영업부, 제주특별자치도 제주시 서사로 56 1층 ,33.5075631400571,126.519672684473,삼도일동
NH농협은행 서광로지점, 제주특별자치도 제주시 서광로 220 ,33.4995658930419,126.52008091726,삼도일동
신한은행 제주기업금융센터, 제주특별자치도 제주시 중앙로 166 ,33.5040331471722,126.526443081752,이도일동
IBK기업은행 제주지점, 제주특별자치도 제주시 중앙로 286 1층 ,33.4947573297223,126.532961293435,이도이동
NH농협은행 노형금융센터, 제주특별자치도 제주시 노형로 407 노형타워 1층 ,33.485821410903,126.478301044424,노형동
Sh수협은행 일도지점, 제주특별자치도 제주시 고마로 117 1층 ,33.5040195551784,126.542062489234,일도이동
NH농협은행 서문지점, 제주특별자치도 제주시 서문로 14 ,33.5094995947342,126.513095031419,용담일동
Sh수협은행 제주지역금융본부, 제주특별자치도 제주시 삼무로 84 ,33.4892707338366,126.495706323581,연동
IBK기업은행 신제주지점, 제주특별자치도 제주시 연북로 17 전문건설회관 1층 ,33.4823888085544,126.483279292562,노형동
NH농협은행 남문지점, 제주특별자치도 제주시 중앙로 217 제주벤처마루 1층 ,33.5003068856361,126.529999616962,이도이동
NH농협은행 연북로지점, 제주특별자치도 제주시 연북로 46 ,33.4816263184478,126.486203760973,노형동
제주은행 본점, 제주특별자치도 제주시 1100로 3351 ,33.4851167973788,126.479346909109,노형동
NH농협은행 광장지점, 제주특별자치도 서귀포시 일주동로 8694 ,33.2531943901125,126.559542936558,서홍동
NH농협은행 서귀포시지부, 제주특별자치도 서귀포시 신중로 30 ,33.2550141029612,126.508472626215,강정동
농협은행 차량등록사무소출장소, 제주특별자치도 제주시 서광로2길 24 ,33.4950628704737,126.518797238902,오라일동
SC제일은행 제주지점, 제주특별자치도 제주시 노형11길 2 정방빌딩 1~3층 ,33.4848273402731,126.478392543066,노형동
IBK기업은행 서귀포지점, 제주특별자치도 서귀포시 일주동로 8671 메트로빌딩 1층 ,33.2530910639216,126.562044995228,서귀동
NH농협은행 제주한라대학교지점, 제주특별자치도 제주시 한라대학로 38 ,33.4767897566467,126.474151903132,노형동
NH농협은행 제주기업지원센터지점, 제주특별자치도 제주시 연삼로 473 경제통상진흥원 1층 ,33.4994335657691,126.540712616697,이도이동
NH농협은행 서귀포지점, 제주특별자치도 서귀포시 일주동로 8610 ,33.2549066930317,126.56844600676,동홍동
NH농협은행 남제주지점, 제주특별자치도 서귀포시 중정로 86 ,33.2481619161833,126.565456253181,서귀동
제주은행 제주시청지점, 제주특별자치도 제주시 광양9길 10 제주시청내 ,33.5002142104177,126.532217532238,이도이동
NH농협은행 JDC첨단지점, 제주특별자치도 제주시 첨단로 213-4 첨단과학기술단지 엘리트빌딩 1층 ,33.4529029642094,126.572552077426,영평동
NH농협은행 제주특별자치도청지점, 제주특별자치도 제주시 문연로 6 ,33.4882207234688,126.497722598412,연동
NH농협은행 제주대학교지점, 제주특별자치도 제주시 제주대학로 102 ,33.4572369752041,126.56429389472,아라일동
제주은행 이도지점, 제주특별자치도 제주시 중앙로 352 ,33.4901540052416,126.537513507677,이도이동
NH농협은행 제주법원지점, 제주특별자치도 제주시 남광북5길 3 ,33.4940960943403,126.535622326028,이도이동
제주은행 연삼로금융센터, 제주특별자치도 제주시 연삼로 511 ,33.5011461692954,126.54389300459,일도이동
노형새마을금고 정존지점, 제주특별자치도 제주시 수덕로 29 ,33.4869036351221,126.473684388842,노형동
제주은행 중앙로금융센터, 제주특별자치도 제주시 오현길 90 ,33.5127652018243,126.52558559436,이도일동
제주은행 신제주금융센터, 제주특별자치도 제주시 신대로 69 ,33.4910870188357,126.496977572471,연동
신한은행 제주공항출장소, 제주특별자치도 제주시 공항로 2 제주국제공항청사 ,33.5059364682672,126.495951277797,용담이동
NH농협은행 제주시청출장소, 제주특별자치도 제주시 광양9길 10 ,33.5002142104177,126.532217532238,이도이동
제주은행 외도지점, 제주특별자치도 제주시 우정로 50 1층 ,33.4885215747132,126.430658986031,외도일동
제주은행 서귀포금융센터, 제주특별자치도 서귀포시 중정로 67 ,33.2481526352928,126.563475438363,서귀동
제주은행 연북로지점, 제주특별자치도 제주시 연북로 54 ,33.4816247516138,126.48708796194,노형동
제주은행 연동지점, 제주특별자치도 제주시 신광로 49 ,33.4876279516743,126.490287340493,연동
제주은행 한림지점, 제주특별자치도 제주시 한림읍 한림로 667 ,33.4147622444457,126.264359849548,한림읍 한림리
제주은행 삼화점, 제주특별자치도 제주시 건주로 27 ,33.5170882126091,126.5811410102,도련일동
신제주새마을금고 본점, 제주특별자치도 제주시 연동11길 14 ,33.4884575359637,126.493108071332,연동
제주은행 아라지점, 제주특별자치도 제주시 중앙로 545 2층 ,33.4748488898022,126.545805329067,아라일동
한국은행 제주본부, 제주특별자치도 제주시 복지로1길 20 ,33.4880794347707,126.519782209377,도남동
제주은행 남문지점, 제주특별자치도 제주시 중앙로 177 ,33.503361572363,126.527463956027,이도일동
제주은행 표선지점, 제주특별자치도 서귀포시 표선면 표선동서로 259 ,33.3268484282001,126.833290933031,표선면 표선리
아라새마을금고 본점, 제주특별자치도 제주시 중앙로 587 ,33.4709109957706,126.54595625917,아라일동
NH농협은행 정부제주지방합동청사출장소, 제주특별자치도 제주시 청사로 59 정부제주지방합동청사 내 1층 ,33.4908650462849,126.525058462742,도남동
용담새마을금고 본점, 제주특별자치도 제주시 용담로 128 ,33.5095610556134,126.514765485957,용담일동
제주은행 서광로지점, 제주특별자치도 제주시 서광로 175 ,33.5003180347391,126.515202972713,용담일동
제주은행 화북금융센터, 제주특별자치도 제주시 일주동로 241 ,33.5198327989352,126.570960870211,화북일동
서귀포새마을금고 본점, 제주특별자치도 서귀포시 중앙로 42 ,33.2483882555107,126.561918117644,서귀동
제주서부새마을금고 본점, 제주특별자치도 제주시 우정로 32 ,33.4901103304041,126.430693136497,외도일동
호남새마을금고 본점, 제주특별자치도 제주시 오현길 69 ,33.510830832033,126.524948442944,이도일동
우정새마을금고 연북로지점, 제주특별자치도 제주시 연북로 567 1층 ,33.4873612408493,126.539527013398,이도이동
제주은행 노형뉴타운지점, 제주특별자치도 제주시 수덕로 49 인당빌딩 1층 ,33.4856338763067,126.47216806603,노형동
호근새마을금고 본점, 제주특별자치도 서귀포시 호근서호로 123 ,33.2571155071878,126.527732817364,호근동
제주은행 서문지점, 제주특별자치도 제주시 관덕로 5 ,33.5129208379056,126.519718315395,삼도이동
제주은행 동홍동지점, 제주특별자치도 서귀포시 일주동로 8560 1층 ,33.255058936956,126.573583025537,동홍동
동문새마을금고 본점, 제주특별자치도 제주시 중앙로13길 34 ,33.5113925504077,126.527998382245,일도일동
제주은행 모슬포지점, 제주특별자치도 서귀포시 대정읍 신영로 75 2층 ,33.2209996508654,126.250818317088,대정읍 하모리
KDB산업은행 제주지점, 제주특별자치도 제주시 신형로 51 ,33.482371549859,126.480681670303,노형동
제주새마을금고 본점, 제주특별자치도 제주시 고마로 49 ,33.5097723383607,126.53957990181,일도이동
산남새마을금고 본점, 제주특별자치도 서귀포시 일주동로 8558 ,33.2550603927801,126.573849908538,동홍동
제주은행 공항지점, 제주특별자치도 제주시 공항로 2 1층 4번게이트 ,33.5059364682672,126.495951277797,용담이동
제주은행 성산지점, 제주특별자치도 서귀포시 성산읍 고성오조로 62 ,33.4493482489429,126.91525398135,성산읍 고성리
노형새마을금고 본점, 제주특별자치도 제주시 다랑곶길 1 1층 ,33.4870792306874,126.478817508907,노형동
NH농협은행 서귀포시청출장소, 제주특별자치도 서귀포시 중앙로 105 ,33.2539547145487,126.559588270998,서홍동
참조은새마을금고 연동지점, 제주특별자치도 제주시 연북로 106 상가동 101호 ,33.4811462974625,126.49340629593,연동
중앙새마을금고 본점, 제주특별자치도 제주시 동광로2길 2 ,33.500771693,126.530199423111,이도이동
서홍새마을금고 본점, 제주특별자치도 서귀포시 중산간동로 8037 ,33.2638970976595,126.557895130085,서홍동
한마음새마을금고 본점, 제주특별자치도 제주시 애월읍 하귀로 75 ,33.4815366377634,126.404609985661,애월읍 하귀2리
한국씨티은행 제주지점, 제주특별자치도 제주시 도령로 33 현대해상빌딩 1층 ,33.4881182734268,126.482400070137,노형동
북제주새마을금고 본점, 제주특별자치도 제주시 한림읍 한림로 684 ,33.4157091179464,126.265292353697,한림읍 한림리
제주새마을금고 이도지점, 제주특별자치도 제주시 신설로 55 한일베라체 601동 104호 ,33.4931973048944,126.548135439028,이도이동
동제주새마을금고 본점, 제주특별자치도 제주시 일주동로 338 ,33.5210214962246,126.581113656492,삼양이동
한라새마을금고 본점, 제주특별자치도 제주시 서사로 150 ,33.4990341772053,126.519580218646,삼도일동
노형새마을금고 서부지점, 제주특별자치도 제주시 노형로 337 ,33.4815015604208,126.472918836901,노형동
동홍새마을금고 본점, 제주특별자치도 서귀포시 동홍중앙로 3 ,33.2509963198758,126.571888495331,동홍동
하나새마을금고 본점, 제주특별자치도 제주시 서사로 40 ,33.5086921700485,126.51966440195,삼도일동
용담새마을금고 용담2동지점, 제주특별자치도 제주시 용문로 155 ,33.5084823379137,126.50971353985,용담이동
NH농협은행 제주특별자치도교육청출장소, 제주특별자치도 제주시 문연로 5 ,33.4901159086412,126.498355228768,연동
우정새마을금고 본점, 제주특별자치도 제주시 조천읍 신북로 216 ,33.5354190843683,126.636113191635,조천읍 조천리
호남새마을금고 도남지점,제주특별자치도 제주시 청사로 85,33.4902834818544,126.527738263239,도남동
제주은행 중문지점, 제주특별자치도 서귀포시 천제연로 244 ,33.2510102566671,126.430759725992,중문동
개인택시새마을금고 본점, 제주특별자치도 제주시 남녕로4길 43 ,33.4925750952729,126.479941775195,연동
강정새마을금고 본점, 제주특별자치도 서귀포시 이어도로 567 ,33.2365750745926,126.477564869931,강정동
하나새마을금고 중앙지점, 제주특별자치도 제주시 연북로 33 ,33.4823414829046,126.48516600076,노형동
한솔새마을금고 본점, 제주특별자치도 제주시 남광북5길 4 ,33.4929878303041,126.536193391298,이도이동
제주은행 삼화출장소, 제주특별자치도 제주시 건주로 27 2층 202호 ,33.5170882126091,126.5811410102,도련일동
서제주새마을금고 연동지점, 제주특별자치도 제주시 연오로 54 ,33.4884142956276,126.501518597155,연동
제주은행 서귀월드지점, 제주특별자치도 서귀포시 일주동로 9213 ,33.248712252659,126.508491059708,법환동
한빛새마을금고 본점, 제주특별자치도 제주시 도남로 58 ,33.49512892212,126.527243535532,도남동
제주서부새마을금고 한라대학로지점, 제주특별자치도 제주시 한라대학로 89 ,33.4765207946455,126.479874397885,노형동
한마음새마을금고 연동지점, 제주특별자치도 제주시 신대로 136 코스모스태홍누리안5차APT 107호 ,33.4850752435992,126.496033953453,연동
동문새마을금고 탐라지점, 제주특별자치도 제주시 박성내동길 27 1층 ,33.4921955678998,126.542002500693,아라이동
열린새마을금고 본점, 제주특별자치도 제주시 관덕로13길 9 ,33.5138180953788,126.525825356816,일도일동
서호새마을금고 본점, 제주특별자치도 서귀포시 서호로 33 ,33.2569984796666,126.522750758411,서호동
납읍새마을금고 본점, 제주특별자치도 제주시 애월읍 중산간서로 5507 ,33.4388709495739,126.328854188346,애월읍 납읍리
동제주새마을금고 삼화지점, 제주특별자치도 제주시 화삼로 55 ,33.514436532985,126.578932023287,도련일동
참조은새마을금고 본점, 제주특별자치도 제주시 한림읍 일주서로 5761 ,33.4397684773777,126.282212791095,한림읍 귀덕리
우리새마을금고 본점, 제주특별자치도 제주시 애월읍 장전로 113 ,33.450801793199,126.390104213367,애월읍 장전리
호남새마을금고 신제주지점, 제주특별자치도 제주시 신광로 96 ,33.483584039339,126.489630169914,연동
남제주새마을금고 본점, 제주특별자치도 서귀포시 대정읍 영서중로 5-6 ,33.2214746071361,126.254132361448,대정읍 하모리
제주새마을금고 일도지점, 제주특별자치도 제주시 신산로 8 ,33.5125259281866,126.531629711638,일도일동
법환새마을금고 본점, 제주특별자치도 서귀포시 이어도로 930-1 ,33.2380222894666,126.513863275274,법환동
제주남원동부새마을금고 본점, 제주특별자치도 서귀포시 남원읍 태위로 654 ,33.2782790867109,126.716569093124,남원읍 남원리
곽지새마을금고 본점, 제주특별자치도 제주시 애월읍 곽지남2길 2 ,33.4460805584996,126.30888959163,애월읍 곽지리
제주은행 제주특별자치도지점,제주특별자치도 제주시 문연로 6,33.4882207234688,126.497722598412,연동
제주은행 제주대학병원출장소, 제주특별자치도 제주시 아란13길 15 본관 지하1층 ,33.4672085209581,126.545201028535,아라일동
하나새마을금고 만덕지점, 제주특별자치도 제주시 동문로 131 ,33.5140257861961,126.540602807376,건입동
제주은행 남원점, 제주특별자치도 서귀포시 남원읍 태위로 701 ,33.2799432633405,126.721370202571,남원읍 남원리
태흥새마을금고 본점, 제주특별자치도 서귀포시 남원읍 태위로 928 ,33.2858718097649,126.744471761501,남원읍 태흥리
새마을금고중앙회 제주지역본부, 제주특별자치도 제주시 해안동 2171 4층  ,33.4671339111884,126.456930067607,해안동
예래동새마을금고 본점, 제주특별자치도 서귀포시 열리로 80 ,33.2470278822994,126.39026197134,상예동
제주은행 영업부, 제주특별자치도 제주시 1100로 3351 ,33.4851167973788,126.479346909109,노형동
서제주새마을금고 본점, 제주특별자치도 제주시 애월읍 일주서로 6693 ,33.4715845721065,126.367217778497,애월읍 신엄리
NH올100종합자산관리센터, 제주특별자치도 제주시 신대로 110 ,33.4874638675359,126.496197657717,연동
제주은행 서귀포시청출장소, 제주특별자치도 서귀포시 중앙로 105 ,33.2539547145487,126.559588270998,서홍동
동홍새마을금고 제2지점, 제주특별자치도 서귀포시 중정로91번길 1 ,33.2486308743032,126.565849248232,서귀동
신례새마을금고 본점, 제주특별자치도 서귀포시 남원읍 신례중앙로 26 ,33.2888478856822,126.62747603087,남원읍 신례리
서귀포동부새마을금고 본점, 제주특별자치도 서귀포시 솔동산로 12 ,33.2436984891432,126.563912508869,서귀동
하원새마을금고 본점, 제주특별자치도 서귀포시 하원로19번길 24 ,33.2569079655956,126.459745815192,하원동
우정새마을금고 김녕지점, 제주특별자치도 제주시 구좌읍 김녕로 83 ,33.5544884196428,126.746893326298,구좌읍 김녕리
서귀포새마을금고 회수지점, 제주특별자치도 서귀포시 중산간서로 656 ,33.2632343310257,126.445175835412,회수동
대포새마을금고 본점, 제주특별자치도 서귀포시 대포로 79 ,33.2428008579826,126.432213290218,대포동
항운노조새마을금고 본점, 제주특별자치도 제주시 만덕로3길 2 ,33.5149345777914,126.532215713718,건입동
대포새마을금고 중문지점, 제주특별자치도 서귀포시 천제연로 237 ,33.2515485858619,126.430103583291,중문동
남제주새마을금고 덕수지점, 제주특별자치도 서귀포시 안덕면 덕수서로 58 ,33.2554873893059,126.304800437655,안덕면 덕수리
제주남원동부새마을금고 고성지점, 제주특별자치도 서귀포시 성산읍 고성오조로 72 ,33.4501405538047,126.914945066146,성산읍 고성리
의귀새마을금고 본점, 제주특별자치도 서귀포시 남원읍 한신로 217 ,33.3100649039419,126.714375243485,남원읍 의귀리
제주은행 제주국제컨벤션센터, 제주특별자치도 서귀포시 중문관광로 224 제주국제컨벤션센타 1층 내국인면세점 앞 ,33.2412896364104,126.424442899565,중문동
산남새마을금고 도순지점, 제주특별자치도 서귀포시 일주서로 329 ,33.2524843157385,126.473512612787,도순동
한마음새마을금고 신촌지점, 제주특별자치도 제주시 조천읍 신촌4길 2 에스디빌신촌2차 ,33.5329417165966,126.619384935976,조천읍 신촌리
제주은행 남원출장소, 제주특별자치도 서귀포시 남원읍 태위로 701 1층 ,33.2799432633405,126.721370202571,남원읍 남원리
서홍새마을금고 남부지점, 제주특별자치도 서귀포시 일주동로 8700 ,33.2530355391104,126.558835262988,서홍동
서호새마을금고 새서귀포지점, 제주특별자치도 서귀포시 김정문화로 57 ,33.2511357462266,126.510848804368,서호동
서귀포동부새마을금고 상효지점, 제주특별자치도 서귀포시 상효로 152 ,33.2728185199962,126.597219658329,상효동
동홍새마을금고 제1지점, 제주특별자치도 서귀포시 중산간동로 8002-2 106호 ,33.2648125322469,126.561974483518,동홍동
한마음새마을금고 광령지점, 제주특별자치도 제주시 애월읍 광성로 277 ,33.4607449425804,126.436603683205,애월읍 광령리
서귀포새마을금고 동홍지점, 제주특별자치도 서귀포시 일주동로 8620 ,33.2551002850467,126.567074654278,동홍동
서귀포새마을금고 광장지점, 제주특별자치도 서귀포시 일주동로 8667 ,33.2531363391011,126.562304892792,서귀동
제주남원동부새마을금고 성산지점, 제주특별자치도 서귀포시 성산읍 성산중앙로 23 ,33.4621293571853,126.932202592747,성산읍 성산리
태흥새마을금고 제1분사무소, 제주특별자치도 서귀포시 남원읍 태위로 810 ,33.2828215186308,126.73243998302,남원읍 태흥리
스마트저축은행 제주여신전문출장소, 제주특별자치도 제주시 중앙로 386 2층 ,33.4878722829685,126.539871749688,이도이동
삼호저축은행 제주지점, 제주특별자치도 제주시 중앙로 535 ,33.4757119518592,126.54520523458,아라일동
한국투자저축은행 제주여신전문출장소, 제주특별자치도 제주시 노형로 407 노형타워 4층 ,33.485821410903,126.478301044424,노형동
제이티친애저축은행 채권관리 제주센터, 제주특별자치도 제주시 청사로 11 주연빌딩 3층,33.4900919876057,126.520158686169,도남동
