id,name,addr,lat,lng,dong,review_rating,review,homepage
390,한라산기프트몰,제주특별자치도 제주시 진동로1길 24  ,33.5192221483348,126.566789532631,화북일동,5.0,"문의 드리고 할 때마다 이것저것 꼼꼼하게 잘 알려주시고, 가겨도 다른 곳이랑 비교해서도 괜찮은 편이어서 매번 먼저 연락하게 되는 것 같네요~ 항상 번창하시고, 건승하시기 바랍니다.",jejuhongbo.com
391,Bakeshirts Store,제주특별자치도 제주시 조천읍 대흘2길 1 2층 ,33.4982809055096,126.654652382029,조천읍 대흘리,5.0,느낌이가 조아요,instagram.com/bakeshirts_store
392,귤아주망,제주특별자치도 서귀포시 대정읍 영서중로13번길 11  ,33.2220392077299,126.254675619015,대정읍 하모리,,,
393,공중전화 서귀포약천사 기념품판매점옆,제주특별자치도 서귀포시 이어도로 293-28  ,33.2452784649815,126.450181604258,대포동,5.0,생각지 않게 수월관음도 감상 할 수 있어  무척 좋았습니다.,
394,꿈팩토리,제주특별자치도 제주시 다랑곶2길 50 1층 ,33.4905987886372,126.475935258474,노형동,,,www.instagram.com/ggumaker
